{
  "authority_effect": "NONE",
  "bundle_kind": "I2_AUTHORIZATION_CONTROL",
  "bundle_root": "sha256-e14-n1-i1-evidence-v1:C6FDE4BFF4D8249598D3460DD766CB7361BB0D0AA97E3B68FEB05F9F637D6CA9",
  "created_on": "2026-08-27",
  "inputs": {
    "direct_case_corpus": {
      "path": "fixtures/e14_n1_scanner_dataflow_cases_v1.json",
      "sha256": "5A1B5A8890B418A700E4D0F51697C036371C399DA0F505810D9FE2235699408C"
    },
    "evidence_schema": {
      "path": "schemas/e14-n1-i1-remediation-evidence-v1.schema.json",
      "sha256": "71F93AFA83837F2F462F47A0F04D4DB0DECA6B9AD4FA851038D587231CA30C7F"
    },
    "evidence_tool": {
      "path": "tools/e14_n1_i1_evidence.py",
      "sha256": "5661342E5577C2A06B9432B474EC09F5C732B62BB2ACE0713EECF53716742589"
    },
    "failed_i1_review": {
      "path": "evidence/n1/scanner-dataflow-review-v1.json",
      "sha256": "9BC16CD18FC0D2672C6D9C12E4EAD21D03246B377F5AC918358B9654E40A9971"
    },
    "g1_v1": {
      "path": "evidence/e14-a2-g1-production-freeze-v1.json",
      "sha256": "57A9A1225972C65280530C040DFACCB68758D5364788216BC31354A5CF8A6916"
    },
    "model_case_corpus": {
      "path": "fixtures/e14_n1_i1_remediation_cases_v1.json",
      "sha256": "495D1D68B8F8886D004C0D48A2F42573F59AF8C3D5DBE91205BFE624D5C35C20"
    },
    "scanner": {
      "path": "src/e14_admission.py",
      "sha256": "D8D51375723E8B705736CD9492825FCE03BC65CDACCE0DD6BE7791E3E51259C7"
    }
  },
  "limitations": [
    "All authorizations are synthetic fixtures; no I2 permission or operation is created."
  ],
  "next_stage_authorized": false,
  "results": {
    "authorization_fields": [
      "active_g1_root",
      "activation_event",
      "activation_epoch",
      "npm_role",
      "wheel_role",
      "operation",
      "request",
      "subject",
      "issuer_role",
      "validity",
      "nonce",
      "revocation_epoch"
    ],
    "issued_authorizations": 0,
    "model_only": true,
    "synthetic_cases": {
      "cases": [
        {
          "actual": "I2_SOURCE_ONLY_AUTHORIZED",
          "case_id": "I2-OK-01",
          "expected": "I2_SOURCE_ONLY_AUTHORIZED",
          "pass": true,
          "scenario": "valid_single_use"
        },
        {
          "actual": "N1_I2_AUTH_MISSING",
          "case_id": "I2-MISSING-01",
          "expected": "N1_I2_AUTH_MISSING",
          "pass": true,
          "scenario": "missing"
        },
        {
          "actual": "N1_I2_AUTH_BINDING_MISMATCH",
          "case_id": "I2-BIND-01",
          "expected": "N1_I2_AUTH_BINDING_MISMATCH",
          "pass": true,
          "scenario": "wrong_binding"
        },
        {
          "actual": "N1_I2_AUTH_EXPIRED",
          "case_id": "I2-EXPIRE-01",
          "expected": "N1_I2_AUTH_EXPIRED",
          "pass": true,
          "scenario": "expired"
        },
        {
          "actual": "N1_I2_AUTH_REVOKED",
          "case_id": "I2-REVOKE-01",
          "expected": "N1_I2_AUTH_REVOKED",
          "pass": true,
          "scenario": "revoked"
        },
        {
          "actual": "N1_I2_AUTH_REPLAY",
          "case_id": "I2-REPLAY-01",
          "expected": "N1_I2_AUTH_REPLAY",
          "pass": true,
          "scenario": "replay"
        }
      ],
      "passed": 6,
      "total": 6
    }
  },
  "run_id": "E14-N1-I1-REMEDIATION-EVIDENCE-2026-08-27-R1",
  "schema": "sana.e14.n1-i1-remediation.i2-authorization-control.v1",
  "status": "PASS"
}
