{
  "authority_effect": "NONE",
  "bundle_kind": "ROLLBACK",
  "bundle_root": "sha256-e14-n1-i1-evidence-v1:1065F079A53507121B59FA12FC6AAC6F700FDD098D5688DACD32EFB6B90D0EC6",
  "created_on": "2026-08-27",
  "inputs": {
    "direct_case_corpus": {
      "path": "fixtures/e14_n1_scanner_dataflow_cases_v1.json",
      "sha256": "5A1B5A8890B418A700E4D0F51697C036371C399DA0F505810D9FE2235699408C"
    },
    "evidence_schema": {
      "path": "schemas/e14-n1-i1-remediation-evidence-v1.schema.json",
      "sha256": "71F93AFA83837F2F462F47A0F04D4DB0DECA6B9AD4FA851038D587231CA30C7F"
    },
    "evidence_tool": {
      "path": "tools/e14_n1_i1_evidence.py",
      "sha256": "5661342E5577C2A06B9432B474EC09F5C732B62BB2ACE0713EECF53716742589"
    },
    "failed_i1_review": {
      "path": "evidence/n1/scanner-dataflow-review-v1.json",
      "sha256": "9BC16CD18FC0D2672C6D9C12E4EAD21D03246B377F5AC918358B9654E40A9971"
    },
    "g1_v1": {
      "path": "evidence/e14-a2-g1-production-freeze-v1.json",
      "sha256": "57A9A1225972C65280530C040DFACCB68758D5364788216BC31354A5CF8A6916"
    },
    "model_case_corpus": {
      "path": "fixtures/e14_n1_i1_remediation_cases_v1.json",
      "sha256": "495D1D68B8F8886D004C0D48A2F42573F59AF8C3D5DBE91205BFE624D5C35C20"
    },
    "scanner": {
      "path": "src/e14_admission.py",
      "sha256": "D8D51375723E8B705736CD9492825FCE03BC65CDACCE0DD6BE7791E3E51259C7"
    }
  },
  "limitations": [
    "The rollback model is not connected to a live cache, queue, worker, or lifecycle service."
  ],
  "next_stage_authorized": false,
  "results": {
    "evidence_immutability": "REQUIRED",
    "roll_forward": "NEW_CANDIDATE_SESSION_ROOTS_AND_RUN",
    "synthetic_cases": {
      "cases": [
        {
          "actual": "CACHE_INVALIDATED",
          "case_id": "ROLL-CACHE-01",
          "expected": "CACHE_INVALIDATED",
          "pass": true,
          "scenario": "cache_invalidated"
        },
        {
          "actual": "QUEUED_AUTH_INVALIDATED",
          "case_id": "ROLL-QUEUE-01",
          "expected": "QUEUED_AUTH_INVALIDATED",
          "pass": true,
          "scenario": "queued_invalidated"
        },
        {
          "actual": "SAFE_STOP_OUTPUT_NONAUTHORITATIVE",
          "case_id": "ROLL-INFLIGHT-01",
          "expected": "SAFE_STOP_OUTPUT_NONAUTHORITATIVE",
          "pass": true,
          "scenario": "inflight_safe_stop"
        },
        {
          "actual": "FINAL_USE_BLOCKED",
          "case_id": "ROLL-UNCERTAIN-01",
          "expected": "FINAL_USE_BLOCKED",
          "pass": true,
          "scenario": "stop_unprovable"
        },
        {
          "actual": "N1_FALLBACK_FORBIDDEN",
          "case_id": "ROLL-V1-01",
          "expected": "N1_FALLBACK_FORBIDDEN",
          "pass": true,
          "scenario": "v1_fallback"
        },
        {
          "actual": "N1_G1_STATE_NOT_ACTIVE",
          "case_id": "ROLL-STALE-01",
          "expected": "N1_G1_STATE_NOT_ACTIVE",
          "pass": true,
          "scenario": "stale_event"
        }
      ],
      "passed": 6,
      "total": 6
    },
    "v1_fallback": "FORBIDDEN"
  },
  "run_id": "E14-N1-I1-REMEDIATION-EVIDENCE-2026-08-27-R1",
  "schema": "sana.e14.n1-i1-remediation.rollback.v1",
  "status": "PASS"
}
