{
  "authority_effect": "NONE",
  "bundle_kind": "DEPENDENCY_APPROVAL",
  "bundle_root": "sha256-e14-n1-i1-evidence-v1:F2D0F87C53014363147BB05B80A61563C3BAFF82933804EC981CB6326D243DC9",
  "created_on": "2026-08-27",
  "inputs": {
    "direct_case_corpus": {
      "path": "fixtures/e14_n1_scanner_dataflow_cases_v1.json",
      "sha256": "5A1B5A8890B418A700E4D0F51697C036371C399DA0F505810D9FE2235699408C"
    },
    "evidence_schema": {
      "path": "schemas/e14-n1-i1-remediation-evidence-v1.schema.json",
      "sha256": "71F93AFA83837F2F462F47A0F04D4DB0DECA6B9AD4FA851038D587231CA30C7F"
    },
    "evidence_tool": {
      "path": "tools/e14_n1_i1_evidence.py",
      "sha256": "5661342E5577C2A06B9432B474EC09F5C732B62BB2ACE0713EECF53716742589"
    },
    "failed_i1_review": {
      "path": "evidence/n1/scanner-dataflow-review-v1.json",
      "sha256": "9BC16CD18FC0D2672C6D9C12E4EAD21D03246B377F5AC918358B9654E40A9971"
    },
    "g1_v1": {
      "path": "evidence/e14-a2-g1-production-freeze-v1.json",
      "sha256": "57A9A1225972C65280530C040DFACCB68758D5364788216BC31354A5CF8A6916"
    },
    "model_case_corpus": {
      "path": "fixtures/e14_n1_i1_remediation_cases_v1.json",
      "sha256": "495D1D68B8F8886D004C0D48A2F42573F59AF8C3D5DBE91205BFE624D5C35C20"
    },
    "scanner": {
      "path": "src/e14_admission.py",
      "sha256": "D8D51375723E8B705736CD9492825FCE03BC65CDACCE0DD6BE7791E3E51259C7"
    }
  },
  "limitations": [
    "No parser dependency, runtime closure, cap headroom, or acquisition root was approved or obtained.",
    "The product need for generalized analysis remains unresolved and out of scope."
  ],
  "next_stage_authorized": false,
  "results": {
    "acquisition_status": "NOT_AUTHORIZED",
    "approval_status": "PENDING_SEPARATE_ACQUISITION_AUTHORIZATION",
    "general_language_claims": "FORBIDDEN",
    "logical_caps": {
      "aggregate_source_bytes": 4194304,
      "ast_depth": 256,
      "ast_nodes": 200000,
      "diagnostic_output_bytes": 4194304,
      "source_bytes_per_file": 2097152,
      "worklist_states": 1000000
    },
    "prohibited_dependencies": [
      "Tree-sitter",
      "Node vm",
      "parser plugins",
      "native analyzer fallback"
    ],
    "proposed_dependencies": [
      "CPython stdlib ast",
      "Node",
      "Acorn"
    ],
    "scope": "EXACT_A2_ONLY"
  },
  "run_id": "E14-N1-I1-REMEDIATION-EVIDENCE-2026-08-27-R1",
  "schema": "sana.e14.n1-i1-remediation.dependency-approval.v1",
  "status": "NOT_RUN"
}
